evid_id,even_id,sent_id,doc_url,crawl_id,crawl_date,text,citation_url,anno_provided_url,fine_grained_location,type,country,date,value,restriction,source_type
0bc017b3-a9dd-409b-8751-c3030517b7a2,be3a2f34-c49b-43c8-bdd2-761ead79f0a2,a2bff85a-8fe2-11ea-a170-069b8ffc8dc8_464,https://en.wikipedia.org/wiki/COVID-19_pandemic_in_Italy,2020-05-06_d0cba9ae-8fda-11ea-b351-069b8ffc8dc8,2020-05-06,"The suspension was later extended, with the agreement of the national government, up to 8 March in Emilia-Romagna, Lombardy, and Veneto.",https://www.repubblica.it/cronaca/2020/02/29/news/le_scuole_ancora_otto_giorni_di_stop_in_lombardia_emilia_e_veneto-249848004/,,Emilia-Romagna|Lombardy|Veneto,entertainment/cultural sector closure,ITA,2020-03-24,"Bars, restaurants, night clubs",1,O
c0461a28-c3a6-4ad8-a024-65cd3ff59b50,31b27769-7718-4c92-892d-736ffb6f773b,a2bff85a-8fe2-11ea-a170-069b8ffc8dc8_168,https://en.wikipedia.org/wiki/COVID-19_pandemic_in_Italy,2020-05-06_d0cba9ae-8fda-11ea-b351-069b8ffc8dc8,2020-05-06,"Streets, parks and train stations in multiple cities in Lombardy were left deserted.",https://www.tgcom24.mediaset.it/cronaca/lombardia/foto/coronavirus-milano-deserta-mezzi-pubblici-vuoti-e-mercati-abbandonati_15301555-2020.shtml,,Lombardy,entertainment/cultural sector closure,ITA,2020-05-10,"Bars, restaurants, night clubs",1,O
4286dd49-c962-4d0d-965c-d561f2cf7c19,b5ca15a4-5dc1-4139-a1f8-dd03712bfcbd,a2bff85a-8fe2-11ea-a170-069b8ffc8dc8_274,https://en.wikipedia.org/wiki/COVID-19_pandemic_in_Italy,2020-05-06_d0cba9ae-8fda-11ea-b351-069b8ffc8dc8,2020-05-06,"On 7 April, after more than a month of suspension, the Italian Basketball Federation officially ended the 2019â20 LBA season, without assigning the title.",https://sportando.basketball/en/italian-basketball-federation-officially-ends-lba-2019-20-season/,,Italy,entertainment/cultural sector closure,ITA,2020-04-07,Gyms and pools,1,O
57a3d329-369b-48fe-b668-a952100cebc4,b5ca15a4-5dc1-4139-a1f8-dd03712bfcbd,a2bff85a-8fe2-11ea-a170-069b8ffc8dc8_275,https://en.wikipedia.org/wiki/COVID-19_pandemic_in_Italy,2020-05-06_d0cba9ae-8fda-11ea-b351-069b8ffc8dc8,2020-05-06,"Italian Basketball Federation officially ends LBA 2019-20 season, Sportando",https://sportando.basketball/en/italian-basketball-federation-officially-ends-lba-2019-20-season/,,Italy,entertainment/cultural sector closure,ITA,2020-04-07,Gyms and pools,1,O
8cd72605-45b3-4844-92de-7dd744be2df3,e4dffd69-c435-4144-81ff-d627a71f1847,a2bff85a-8fe2-11ea-a170-069b8ffc8dc8_31,https://en.wikipedia.org/wiki/COVID-19_pandemic_in_Italy,2020-05-06_d0cba9ae-8fda-11ea-b351-069b8ffc8dc8,2020-05-06,"On 31 January, the Italian government suspended all flights to and from China and declared a state of emergency with the duration of six months.",https://www.thelocal.it/20200131/italy-suspends-all-china-flights-after-coronavirus-cases-confirmed-in-rome/,,Italy,international flight restrictions,ITA,2020-01-31,CHN,1,O
1b43bb78-6cb4-4231-bd84-bc32df69aa00,a049ed78-119a-4552-a1ca-e77e1610835f,a2bff85a-8fe2-11ea-a170-069b8ffc8dc8_312,https://en.wikipedia.org/wiki/COVID-19_pandemic_in_Italy,2020-05-06_d0cba9ae-8fda-11ea-b351-069b8ffc8dc8,2020-05-06,"On 25 February, the United Kingdom and Malta recommended that travellers coming from Italy self-quarantine for 14 days and for all citizens not to travel to regions of Italy affected by the outbreak.",https://www.bbc.com/news/uk-51625733,,Italy,introduction of travel quarantine policies,ITA,2020-02-25,MLT,1,O
a403f5b4-4060-4dc9-807d-560ff8b860f3,7647e44d-6895-491b-9afa-24903ea18692,a2bff85a-8fe2-11ea-a170-069b8ffc8dc8_420,https://en.wikipedia.org/wiki/COVID-19_pandemic_in_Italy,2020-05-06_d0cba9ae-8fda-11ea-b351-069b8ffc8dc8,2020-05-06,The pandemic provoked large economic damage to the Italian economy.,https://www.theguardian.com/travel/2020/mar/17/nothing-less-than-a-catastrophe-venice-left-high-and-dry-by-coronavirus,,Italy,economic impact,ITA,2020-04-04,na,1,O
5a9a70fd-0c77-4201-973c-d08e138cdafe,a8a88d9b-51fe-490f-9320-ddc5ff440faa,a2bff85a-8fe2-11ea-a170-069b8ffc8dc8_265,https://en.wikipedia.org/wiki/COVID-19_pandemic_in_Italy,2020-05-06_d0cba9ae-8fda-11ea-b351-069b8ffc8dc8,2020-05-06,"Parks, playgrounds and public green were closed down.",https://www.ilpost.it/2020/03/20/ordinanza-coronavirus-attivita-sportiva-correre/,,Italy,entertainment/cultural sector closure,ITA,2020-03-20,Parks and public gardens,1,O
41ff1280-6f76-4cf4-89a0-1aa6f38d3041,59510cd3-b780-462c-acfb-873f61a5c36e,a2bff85a-8fe2-11ea-a170-069b8ffc8dc8_460,https://en.wikipedia.org/wiki/COVID-19_pandemic_in_Italy,2020-05-06_d0cba9ae-8fda-11ea-b351-069b8ffc8dc8,2020-05-06,"Some Italians have adapted the local custom of paying in advance at a cafe for a customer who can't afford it (""suspended coffee"") by paying extra at grocery stores.",Some Italians have adapted the local custom o,,Italians,economic impact,ITA,2020-03-14,Industrial production,1,O
2edc890e-b7f2-4b5e-b1e2-1e5fcea9a4ef,2f705525-23ae-4c23-b69f-ee9caa13a291,a2bff85a-8fe2-11ea-a170-069b8ffc8dc8_285,https://en.wikipedia.org/wiki/COVID-19_pandemic_in_Italy,2020-05-06_d0cba9ae-8fda-11ea-b351-069b8ffc8dc8,2020-05-06,"The plan allowed the re-opening of manufacturing industries and construction sites, however schools, bars, restaurants and hairdressers would stay closed.",https://www.theguardian.com/world/2020/apr/27/italy-unveils-plans-for-easing-of-coronavirus-lockdown-restrictions-conte,,Italy,school closure,ITA,2020-04-26,Only schools (primary/secondary) closed,1,O
9d95de86-73c3-40cb-aded-bb87ce418b9d,83f99b38-0f35-4453-a91d-e51630f689d1,a2bff85a-8fe2-11ea-a170-069b8ffc8dc8_285,https://en.wikipedia.org/wiki/COVID-19_pandemic_in_Italy,2020-05-06_d0cba9ae-8fda-11ea-b351-069b8ffc8dc8,2020-05-06,"The plan allowed the re-opening of manufacturing industries and construction sites, however schools, bars, restaurants and hairdressers would stay closed.",https://www.theguardian.com/world/2020/apr/27/italy-unveils-plans-for-easing-of-coronavirus-lockdown-restrictions-conte,,Italy,entertainment/cultural sector closure,ITA,2020-04-26,"Bars, restaurants, night clubs",1,O
8cd72605-45b3-4844-92de-7dd744be2df3,924b177b-51b5-4232-89b5-48295a63b1da,a2bff85a-8fe2-11ea-a170-069b8ffc8dc8_31,https://en.wikipedia.org/wiki/COVID-19_pandemic_in_Italy,2020-05-06_d0cba9ae-8fda-11ea-b351-069b8ffc8dc8,2020-05-06,"On 31 January, the Italian government suspended all flights to and from China and declared a state of emergency with the duration of six months.",https://www.thelocal.it/20200131/italy-suspends-all-china-flights-after-coronavirus-cases-confirmed-in-rome/,,Italy,state of emergency (legal impact),ITA,2020-01-31,na,1,O
8f6fb98b-4b02-4241-96b6-f6a7a610f7f8,7d40103c-c12a-11ea-8d21-eeee0af72e81,a2bff85a-8fe2-11ea-a170-069b8ffc8dc8_160,https://en.wikipedia.org/wiki/COVID-19_pandemic_in_Italy,2020-05-06_d0cba9ae-8fda-11ea-b351-069b8ffc8dc8,2020-05-06,Authorities in Veneto cancelled the last two days of the Carnival of Venice.,https://www.bbc.com/news/world-europe-51602007,,Veneto,entertainment/cultural sector closure,ITA,2020-02-23,"Museums, theaters, cinema, libraries, festivities",1,O
f70473ba-2cdc-4b1c-b6ec-717f20789d24,a206099e-c12a-11ea-890b-eeee0af49f8d,a2bff85a-8fe2-11ea-a170-069b8ffc8dc8_179,https://en.wikipedia.org/wiki/COVID-19_pandemic_in_Italy,2020-05-06_d0cba9ae-8fda-11ea-b351-069b8ffc8dc8,2020-05-06,Court proceedings were postponed until further notice.,https://www.repubblica.it/cronaca/2020/02/23/news/coronavirus_scuole_chiuse_e_niente_carnevale_tutti_i_provvedimenti-249355737/,,ITA,public services closure,ITA,2020-02-24,Legal system,1,O
301f958b-36bf-4ed7-b95b-b5807ab3f0db,130e3429-4392-467a-b5fe-7ff3828604f0,a2bff85a-8fe2-11ea-a170-069b8ffc8dc8_344,https://en.wikipedia.org/wiki/COVID-19_pandemic_in_Italy,2020-05-06_d0cba9ae-8fda-11ea-b351-069b8ffc8dc8,2020-05-06,On same day also Austria barred entry to foreign nationals travelling from Italy with exception for people with medical documents and people who travel only through Austria to Germany without stop in Austria.,"https://www.br.de/nachrichten/deutschland-welt/oesterreich-will-einreisen-aus-italien-weitgehend-stoppen,RspR1PZ",,Austria|Italy|Austria|Germany|Austria,freedom of movement (nationality dependent),ITA,2020-03-10,AUT,1,O
db223650-b19d-4aaa-ba6e-0222493bf437,052f8f1d-dca4-4716-9915-fc409497d1a4,a2bff85a-8fe2-11ea-a170-069b8ffc8dc8_344,https://en.wikipedia.org/wiki/COVID-19_pandemic_in_Italy,2020-05-06_d0cba9ae-8fda-11ea-b351-069b8ffc8dc8,2020-05-06,On same day also Austria barred entry to foreign nationals travelling from Italy with exception for people with medical documents and people who travel only through Austria to Germany without stop in Austria.,"https://www.br.de/nachrichten/deutschland-welt/oesterreich-will-einreisen-aus-italien-weitgehend-stoppen,RspR1PZ",,Austria|Italy|Austria|Germany|Austria,freedom of movement (nationality dependent),ITA,2020-03-10,DEU,1,O
8aaee400-bc6b-4a5c-bbf6-e61702d4d2b4,80b6bd27-e243-4da8-8029-6c4cc4117d29,a2bff85a-8fe2-11ea-a170-069b8ffc8dc8_184,https://en.wikipedia.org/wiki/COVID-19_pandemic_in_Italy,2020-05-06_d0cba9ae-8fda-11ea-b351-069b8ffc8dc8,2020-05-06,General Tod D. Walters issued a travel ban covering the areas of Italy affected by the outbreak for US service members and their families.,https://www.rollcall.com/2020/02/25/coronavirus-threatens-u-s-military-base-operations-in-europe-general-says/,,Italy|Us,freedom of movement (nationality dependent),ITA,2020-02-25,USA,1,O
a6db5641-39fd-4945-953b-0276d3a22921,d4bdae27-9a7f-4e3c-9d41-17fd1646c120,a2bff85a-8fe2-11ea-a170-069b8ffc8dc8_225,https://en.wikipedia.org/wiki/COVID-19_pandemic_in_Italy,2020-05-06_d0cba9ae-8fda-11ea-b351-069b8ffc8dc8,2020-05-06,"A yellow zone (composed of the regions of Lombardy, Veneto and Emilia-Romagna), where social and sport events are suspended and schools, theatres, clubs and cinemas are closed.",https://www.repubblica.it/politica/2020/03/01/news/coronavirus_misure_governo-249980561/,,Lombardy|Veneto|Emilia-Romagna,entertainment/cultural sector closure,ITA,2020-03-01,"Bars, restaurants, night clubs",1,O
3f9d0062-bd9a-453b-91e3-a1c0b2c113b4,5a1a4325-a148-434a-a12d-99880dd63909,a2bff85a-8fe2-11ea-a170-069b8ffc8dc8_237,https://en.wikipedia.org/wiki/COVID-19_pandemic_in_Italy,2020-05-06_d0cba9ae-8fda-11ea-b351-069b8ffc8dc8,2020-05-06,"The decree imposed the closure of museums, cultural centres and ski resorts in the lockdown areas and the closure of cinemas, theatres, pubs, dance schools, game rooms, betting rooms and bingo halls, discos and similar places in the entire country.",https://www.romatoday.it/attualita/coronavirus-pub-cinema-teatri-locali-chiusi-nuovo-decreto.html,,Italy,entertainment/cultural sector closure,ITA,2020-02-06,"Bars, restaurants, night clubs",1,O
4d7133ae-1263-47a6-990c-2cd80762c667,bd9c2b95-f3a8-4228-9ed2-af4d63a0ce4a,a2bff85a-8fe2-11ea-a170-069b8ffc8dc8_252,https://en.wikipedia.org/wiki/COVID-19_pandemic_in_Italy,2020-05-06_d0cba9ae-8fda-11ea-b351-069b8ffc8dc8,2020-05-06,"On 9 March, the government announced that all sporting events in Italy would be cancelled until at least 3 April, but the ban does not include Italian clubs or national teams participating in international competitions.",https://www.bbc.com/sport/51808683,,Italy,entertainment/cultural sector closure,ITA,2020-03-09,"Bars, restaurants, night clubs",1,O
b40e5dca-d978-474f-ba48-1307b0984678,eec69b02-a180-4051-b7e1-230d04dd7383,a2bff85a-8fe2-11ea-a170-069b8ffc8dc8_225,https://en.wikipedia.org/wiki/COVID-19_pandemic_in_Italy,2020-05-06_d0cba9ae-8fda-11ea-b351-069b8ffc8dc8,2020-05-06,"A yellow zone (composed of the regions of Lombardy, Veneto and Emilia-Romagna), where social and sport events are suspended and schools, theatres, clubs and cinemas are closed.",https://www.repubblica.it/politica/2020/03/01/news/coronavirus_misure_governo-249980561/,,Lombardy|Veneto|Emilia-Romagna,entertainment/cultural sector closure,ITA,2020-03-01,"Museums, theaters, cinema, libraries, festivities",1,O
fb0d7016-3b7a-4b6b-b7b6-db3977c4df37,e9a0d7eb-9b40-4b9f-b1c5-fdebec17c900,a2bff85a-8fe2-11ea-a170-069b8ffc8dc8_237,https://en.wikipedia.org/wiki/COVID-19_pandemic_in_Italy,2020-05-06_d0cba9ae-8fda-11ea-b351-069b8ffc8dc8,2020-05-06,"The decree imposed the closure of museums, cultural centres and ski resorts in the lockdown areas and the closure of cinemas, theatres, pubs, dance schools, game rooms, betting rooms and bingo halls, discos and similar places in the entire country.",https://www.romatoday.it/attualita/coronavirus-pub-cinema-teatri-locali-chiusi-nuovo-decreto.html,,Italy,entertainment/cultural sector closure,ITA,2020-02-06,"Museums, theaters, cinema, libraries, festivities",1,O
e475e24f-0287-4309-b418-ae3c5468ea03,6d472bdf-45ea-4b07-8e76-29e751e83f28,a2bff85a-8fe2-11ea-a170-069b8ffc8dc8_465,https://en.wikipedia.org/wiki/COVID-19_pandemic_in_Italy,2020-05-06_d0cba9ae-8fda-11ea-b351-069b8ffc8dc8,2020-05-06,"On 4 March, the government announced the closure of all schools and colleges until 15 March.",http://www.thetelegram.com/news/world/coronavirus-deprives-nearly-300-million-students-of-their-schooling-unesco-419714/,,Italy,school closure,ITA,2020-03-04,Only schools (primary/secondary) closed,1,O
8d0b3cc6-5b8e-4698-bff6-9cf4d9b444f8,6d472bdf-45ea-4b07-8e76-29e751e83f28,a2bff85a-8fe2-11ea-a170-069b8ffc8dc8_228,https://en.wikipedia.org/wiki/COVID-19_pandemic_in_Italy,2020-05-06_d0cba9ae-8fda-11ea-b351-069b8ffc8dc8,2020-05-06,"On 4 March, the Italian government imposed the shutdown of all schools and universities nationwide for two weeks as the country reached 100 deaths from the outbreak.",https://www.theguardian.com/world/2020/mar/04/italy-orders-closure-of-schools-and-universities-due-to-coronavirus,,Italian,school closure,ITA,2020-03-04,Only schools (primary/secondary) closed,1,O
a448166c-8858-4a81-a8ce-c0ba9d9b5ef6,1794740e-635b-4d7f-b49c-678c0d9ffd7f,a2bff85a-8fe2-11ea-a170-069b8ffc8dc8_237,https://en.wikipedia.org/wiki/COVID-19_pandemic_in_Italy,2020-05-06_d0cba9ae-8fda-11ea-b351-069b8ffc8dc8,2020-05-06,"The decree imposed the closure of museums, cultural centres and ski resorts in the lockdown areas and the closure of cinemas, theatres, pubs, dance schools, game rooms, betting rooms and bingo halls, discos and similar places in the entire country.",https://www.romatoday.it/attualita/coronavirus-pub-cinema-teatri-locali-chiusi-nuovo-decreto.html,,Italy,school closure,ITA,2020-02-06,Only schools (primary/secondary) closed,1,O
2b289876-d8f8-4cde-ba10-427d42f1d73a,7b04c773-7dc5-41bf-a8f9-3a85d8aa98a1,a2bff85a-8fe2-11ea-a170-069b8ffc8dc8_467,https://en.wikipedia.org/wiki/COVID-19_pandemic_in_Italy,2020-05-06_d0cba9ae-8fda-11ea-b351-069b8ffc8dc8,2020-05-06,"On 9 March, the government extended the lockdown to the national territory, closing all schools and universities until 3 April.",https://apnews.com/3ff579e06d07428f0bc993c0a98c001d,,Italy,school closure,ITA,2020-03-09,Only schools (primary/secondary) closed,1,O
52776a43-853e-4d1c-892c-3cf5e7ec3dc7,922e3de7-02d4-4e1e-9ce2-ce2ce719071f,a2bff85a-8fe2-11ea-a170-069b8ffc8dc8_133,https://en.wikipedia.org/wiki/COVID-19_pandemic_in_Italy,2020-05-06_d0cba9ae-8fda-11ea-b351-069b8ffc8dc8,2020-05-06,"Starting on 8 March, the region of Lombardy together with 14 additional northern and central provinces in Piedmont, Emilia-Romagna, Veneto, and Marche, were put under lockdown.",https://www.bbc.com/news/world-middle-east-51787238,,Lombardy|Piedmont|Emilia-Romagna|Veneto|Marche,confinement,ITA,2020-03-08,na,1,O
ea48f256-d03c-43d0-b2fc-9b9a56a4c2eb,922e3de7-02d4-4e1e-9ce2-ce2ce719071f,a2bff85a-8fe2-11ea-a170-069b8ffc8dc8_621,https://en.wikipedia.org/wiki/COVID-19_pandemic_in_Italy,2020-05-06_d0cba9ae-8fda-11ea-b351-069b8ffc8dc8,2020-05-06,"As of 8 March 24, 31 confirmed cases in the country have links to Italy, leading the government to institute a mandatory quarantine for all persons with a history of recent travel to Italy.",https://www.idnes.cz/zpravy/domaci/koronavirus-nemocnice-bulovka-pocet-potvrzenych-pripadu.A200308_124539_domaci_remy,,Italy|Italy,confinement,ITA,2020-03-08,na,1,O
9b60e3aa-657f-4dca-9597-1bc6a2fd0bd8,922e3de7-02d4-4e1e-9ce2-ce2ce719071f,a2bff85a-8fe2-11ea-a170-069b8ffc8dc8_92,https://en.wikipedia.org/wiki/COVID-19_pandemic_in_Italy,2020-05-06_d0cba9ae-8fda-11ea-b351-069b8ffc8dc8,2020-05-06,"On 8 March, Prime Minister Giuseppe Conte extended the quarantine lockdown to cover the whole region of Lombardy and 14 other northern provinces.",https://www.bbc.com/news/world-middle-east-51787238,,Lombardy,confinement,ITA,2020-03-08,na,1,O
d0d4fc56-0e3b-4af2-a420-6e0841c69a19,922e3de7-02d4-4e1e-9ce2-ce2ce719071f,a2bff85a-8fe2-11ea-a170-069b8ffc8dc8_466,https://en.wikipedia.org/wiki/COVID-19_pandemic_in_Italy,2020-05-06_d0cba9ae-8fda-11ea-b351-069b8ffc8dc8,2020-05-06,"With the enactment of the lockdown of Lombardy and 14 more northern provinces on 8 March, the re-opening of schools in these areas was delayed to 3 April.",https://www.theguardian.com/world/2020/mar/07/italy-set-to,,Lombardy,confinement,ITA,2020-03-08,na,1,O
17317749-d1c2-4aa6-807a-5fb3ff4a4f17,922e3de7-02d4-4e1e-9ce2-ce2ce719071f,a2bff85a-8fe2-11ea-a170-069b8ffc8dc8_8,https://en.wikipedia.org/wiki/COVID-19_pandemic_in_Italy,2020-05-06_d0cba9ae-8fda-11ea-b351-069b8ffc8dc8,2020-05-06,"On 8 March 2020, Prime Minister Giuseppe Conte expanded the quarantine to all of Lombardy and 14 other northern provinces, and on the following day to all of Italy, placing more than 60 million people in quarantine.",https://news.sky.com/story/coronavirus-italy-sees-largest-daily-rise-in-deaths-and-confirmed-cases-11953192,,Lombardy|Italy,confinement,ITA,2020-03-08,na,1,O
0b312c11-6f06-4970-b663-3d97ab1841ae,ca356fde-48d4-4dfc-a82c-c3c23e58138f,a2bff85a-8fe2-11ea-a170-069b8ffc8dc8_205,https://en.wikipedia.org/wiki/COVID-19_pandemic_in_Italy,2020-05-06_d0cba9ae-8fda-11ea-b351-069b8ffc8dc8,2020-05-06,The MIDO Milan Eyewear Show was rescheduled to 5 to 7 July.,http://www.wmido.com/ita-la-50a-edizione-di-mido-si-terra-dal-5-al-7-luglio/,,,entertainment/cultural sector closure,ITA,2020-02-26,na,1,O
3f5fe81a-ff0a-4677-99f6-43374842a86f,ca356fde-48d4-4dfc-a82c-c3c23e58138f,a2bff85a-8fe2-11ea-a170-069b8ffc8dc8_324,https://en.wikipedia.org/wiki/COVID-19_pandemic_in_Italy,2020-05-06_d0cba9ae-8fda-11ea-b351-069b8ffc8dc8,2020-05-06,"The chief executive of the Irish Rugby Football Union, Philip Browne, cancelled Six Nations Championship rugby matches between Ireland and Italy from 6 to 8 March in Dublin.",https://www.theguardian.com/sport/2020/feb/26/ireland-v-italy-six-nations-match-postponed-due-to-coronavirus,,The Irish Rugby Football Union|Ireland|Italy|Dublin,entertainment/cultural sector closure,ITA,2020-02-26,na,1,O
689d1cdb-c509-43db-972a-ef879ce49d0a,216b385c-0314-4846-9477-55cee310c1ba,a2bff85a-8fe2-11ea-a170-069b8ffc8dc8_552,https://en.wikipedia.org/wiki/COVID-19_pandemic_in_Italy,2020-05-06_d0cba9ae-8fda-11ea-b351-069b8ffc8dc8,2020-05-06,"On 4 March 14 more Italian tourists who were kept at a quarantine facility in Delhi were confirmed positive, as well as the group's Indian driver.",https://economictimes.indiatimes.com/news/politics-and-nation/28-confirmed-cases-of-coronavirus-in-india-gom-to-meet-today-health-minister-harsh-vardhan/articleshow/74472369.cms,,Italian|Delhi|Indian,confinement,ITA,2020-03-04,na,1,O
1d82ebf4-4213-4db4-9214-0f9b150eb6c4,c897c3c6-f66a-4655-ab12-24bb3c9ff97a,a2bff85a-8fe2-11ea-a170-069b8ffc8dc8_153,https://en.wikipedia.org/wiki/COVID-19_pandemic_in_Italy,2020-05-06_d0cba9ae-8fda-11ea-b351-069b8ffc8dc8,2020-05-06,"Regional train services to the most affected areas were suspended, with trains skipping stops at Codogno, Maleo and Casalpusterlengo stations.",https://milano.repubblica.it/cronaca/2020/02/22/news/coronavirus_il_comune_di_milano_sospende_dal_lavoro_i_dipendenti_che_abitano_delle_zone_coinvolte-249252812/,,Codogno|Maleo|Casalpusterlengo,public transportation,ITA,2020-02-22,na,1,O
1a07574f-a1d8-4b42-be77-53b638d846a8,1a868c43-84fa-41e1-a553-3b7ad17a7db2,a2bff85a-8fe2-11ea-a170-069b8ffc8dc8_168,https://en.wikipedia.org/wiki/COVID-19_pandemic_in_Italy,2020-05-06_d0cba9ae-8fda-11ea-b351-069b8ffc8dc8,2020-05-06,"Streets, parks and train stations in multiple cities in Lombardy were left deserted.",https://www.tgcom24.mediaset.it/cronaca/lombardia/foto/coronavirus-milano-deserta-mezzi-pubblici-vuoti-e-mercati-abbandonati_15301555-2020.shtml,,Lombardy,public transportation,ITA,2020-05-10,na,1,O
870a8d95-5bee-4ea6-bd36-88ef5e8d1658,e51edb3d-4de4-432a-8cc7-cd4ea9426839,a2bff85a-8fe2-11ea-a170-069b8ffc8dc8_189,https://en.wikipedia.org/wiki/COVID-19_pandemic_in_Italy,2020-05-06_d0cba9ae-8fda-11ea-b351-069b8ffc8dc8,2020-05-06,"Morgan Stanley, Barclays, Mediobanca and UniCredit requested their Milan staff to work from home.",https://www.reuters.com/article/us-china-health-banks-idUSKCN20I2LW,,Morgan Stanley|Barclays|Mediobanca|Unicredit|Milan,confinement,ITA,2020-02-25,na,1,O
f009bc2b-efec-4e2f-ac30-7c3e6a5220bc,4177449b-fa61-4ab4-a0db-23ba5808ac8d,a2bff85a-8fe2-11ea-a170-069b8ffc8dc8_191,https://en.wikipedia.org/wiki/COVID-19_pandemic_in_Italy,2020-05-06_d0cba9ae-8fda-11ea-b351-069b8ffc8dc8,2020-05-06,"Salone del Mobile, a furniture fair in Milan, was postponed to 16 to 21 June.",https://www.ilsole24ore.com/art/coronavirus-salone-mobile-rinviato-giugno-AClPZvLB,,Salone Del Mobile|Milan,entertainment/cultural sector closure,ITA,2020-02-25,na,1,O
f8c47c5d-4199-4ae5-9201-a1ebe5d16d31,4177449b-fa61-4ab4-a0db-23ba5808ac8d,a2bff85a-8fe2-11ea-a170-069b8ffc8dc8_194,https://en.wikipedia.org/wiki/COVID-19_pandemic_in_Italy,2020-05-06_d0cba9ae-8fda-11ea-b351-069b8ffc8dc8,2020-05-06,"Expocasa, a furniture fair in Turin, was rescheduled initially to 28 March to 5 April but later to future date to be announced later.",https://www.expocasa.it/3796/aggiornamenti-corona-virus,,Turin,entertainment/cultural sector closure,ITA,2020-02-25,na,1,O
558d25d3-eab3-4b75-b50f-7b005611485c,4177449b-fa61-4ab4-a0db-23ba5808ac8d,a2bff85a-8fe2-11ea-a170-069b8ffc8dc8_187,https://en.wikipedia.org/wiki/COVID-19_pandemic_in_Italy,2020-05-06_d0cba9ae-8fda-11ea-b351-069b8ffc8dc8,2020-05-06,"The Italian Basketball Federation suspended all of its championship games, including Lega Basket Serie A.Istituto Tecnico Economico Enrico Tosi in Varese, Istituto Comprensivo di Pianoro in Bologna and Liceo Attilio Bertolucci in Parma conducted lessons for students online while waiting for the schools to reopen.",https://www.raisport.rai.it/articoli/2020/02/basket-A-A2-maschile-femminile-6592d551-065e-4245-931a-488e53809874.html|https://parma.repubblica.it/cronaca/2020/02/26/news/coronavirus_confinati_si_isolati_no_il_racconto_dei_liceali_di_parma_dalle_loro_camere-249616316/,,The Italian Basketball Federation|Lega Basket Serie A.Istituto|Varese|Istituto Comprensivo Di Pianoro|Bologna|Parma,entertainment/cultural sector closure,ITA,2020-02-25,na,1,O
3e3acf33-f906-4213-9350-1b2db51d57d5,4177449b-fa61-4ab4-a0db-23ba5808ac8d,a2bff85a-8fe2-11ea-a170-069b8ffc8dc8_190,https://en.wikipedia.org/wiki/COVID-19_pandemic_in_Italy,2020-05-06_d0cba9ae-8fda-11ea-b351-069b8ffc8dc8,2020-05-06,Multiple fairs and exhibitions were rescheduled.,https://www.ilsole24ore.com/art/coronavirus-salone-mobile-rinviato-giugno-AClPZvLB,,,entertainment/cultural sector closure,ITA,2020-02-25,na,1,O
3b20fb6f-a489-4d71-9035-08b3d1354407,1cdd48bc-1c45-4ec1-b22e-950444ad1285,a2bff85a-8fe2-11ea-a170-069b8ffc8dc8_210,https://en.wikipedia.org/wiki/COVID-19_pandemic_in_Italy,2020-05-06_d0cba9ae-8fda-11ea-b351-069b8ffc8dc8,2020-05-06,The Winter Rescue Race in Piedmont was cancelled.,https://www.unionemonregalese.it/2020/02/27/annullata-coronavirus-winter-rescue-race-artesina/,,Piedmont,entertainment/cultural sector closure,ITA,2020-02-29,na,1,O
6db0541a-8e00-43f3-b20a-ae287f430e02,9ea7937a-d41c-4e92-982e-1852517e5b45,a2bff85a-8fe2-11ea-a170-069b8ffc8dc8_253,https://en.wikipedia.org/wiki/COVID-19_pandemic_in_Italy,2020-05-06_d0cba9ae-8fda-11ea-b351-069b8ffc8dc8,2020-05-06,"In the evening, Conte announced in a press conference that all measures previously applied only in the so-called ""red zones"" had been extended to the whole country, putting approximately 60 million people in lockdown.",https://edition.cnn.com/2020/03/09/europe/coronavirus-italy-lockdown-intl/index.html,,Italy,confinement,ITA,2020-03-09,na,1,O
e8880fac-941b-45a2-8479-b1e07363388a,f06bc2ae-3615-4b95-8bc0-345e6c95df8f,a2bff85a-8fe2-11ea-a170-069b8ffc8dc8_146,https://en.wikipedia.org/wiki/COVID-19_pandemic_in_Italy,2020-05-06_d0cba9ae-8fda-11ea-b351-069b8ffc8dc8,2020-05-06,"On 22 February, the government announced a new decree imposing the quarantine of more than 50,000 people from 11 municipalities in Northern Italy.",https://milano.repubblica.it/cronaca/2020/02/21/news/coronavirus_codogno_castiglione_d_adda_contagiati_misure_sicurezza-249154447/,,Northern Italy,confinement,ITA,2020-02-22,na,1,O
6940cf0b-5400-49dd-b2fd-c513167f6e3b,f06bc2ae-3615-4b95-8bc0-345e6c95df8f,a2bff85a-8fe2-11ea-a170-069b8ffc8dc8_147,https://en.wikipedia.org/wiki/COVID-19_pandemic_in_Italy,2020-05-06_d0cba9ae-8fda-11ea-b351-069b8ffc8dc8,2020-05-06,The quarantine zones are called the Red Zones and the areas in Lombardy and Veneto outside of them are called the Yellow Zones.,https://milano.repubblica.it/cronaca/2020/02/21/news/coronavirus_codogno_castiglione_d_adda_contagiati_misure_sicurezza-249154447/,,Lombardy|Veneto|The Yellow Zones,confinement,ITA,2020-02-22,na,1,O
